"property","title","description"
"","Store Access Control ID Rule","Store Access Control ID Rule"
"cn","Name","Arbitrary/Meaningful name of the Store Access Control ID Rule"
"dcmStoreAccessControlID","Store Access Control ID","Access Control ID assigned to Studies which attributes match all conditions"
"dcmRulePriority","Rule Priority","Rule Priority."
"dcmProperty","Conditions","Conditions in format (SendingHostname|SendingApplicationEntityTitle|ReceivingHostname|ReceivingApplicationEntityTitle|{AttributeTagOrKeyword[number]}|{SequenceTagOrKeyword.AttributeTagOrKeyword})[!]={regEx}. More than one value can be specified for a given attribute by separating them with a | symbol. Examples: SendingApplicationEntityTitle=FORWARD or Modality=MR|CT or ProcedureCodeSequence.CodeValue=MRProcedure or 00180015=KNEE or 00321034.00080100=RequestingServiceCode or ImageType[3]=LOCALIZER"
