"property","title","description"
"","प्रतिमा वाचक","संकुचित DICOM दृष्टांते असंकुचित करण्यात वापरलेले JAVA प्रतिमा IO प्रतिमा वाचक निर्दिष्ट करते."
"dicomTransferSyntax","हस्तांतरण वाक्यरचना","संकुचित DICOM प्रतिमेचे हस्तांतरण वाक्यरचना."
"dcmIIOFormatName","प्रतिमा IO वाचक प्रारूपाचे नाव","प्रतिमा IO वाचक प्रारूपाचे नाव."
"dcmJavaClassName","JAVA वर्गचे नाव","प्रतिमा IO वाचकचा पूर्णपणे पात्र JAVA वर्ग. अनुपस्थित असल्यास, निर्दिष्ट प्रारूपाच्या नावासाठी आढळलेला कोणताही प्रतिमा वाचक वापरा."
"dcmPatchJPEGLS","पॅच JPEG-LS","असंकुचित करायच्या आधी JPEG-LS पॅच करा."
"dcmImageReadParam","प्रतिमा वाचन मापदंड","प्रतिमा वाचन मापदंड (नाव=मूल्य)."
