"property","title","description"
"","आर्काइव गुण नियंत्रण","प्राप्त किये या भेजे हुए डिमसे का आर्काइव गुण नियंत्रण"
"cn","नाम","आर्काइव गुण नियंत्रण का मनमाना/सार्थक नाम"
"dcmRulePriority","नियम प्राथमिकता","नियम प्राथमिकता."
"dcmDIMSE","डिमसे","डाइकोम सन्देश तत्त्व जिसपे ये गुण नियंत्रण लागू होगा"
"dicomTransferRole","डाइकोम स्थानांतरण भूमिका","समान पदस्थ डाइकोम एइ का डाइकोम स्थानांतरण भूमिका"
"dcmSOPClass","सोप क्लास यूआईडी","सोप क्लास की यूआईडी जिसपे ये गुण नियंत्रण लागू किया जाएगा. अगर कॉन्फ़िगर ना किया हो तो, किसी सोप क्लास पे लागू करें"
"dcmProperty","नियम","नियम इस फॉर्मेट में (SendingHostname|SendingApplicationEntityTitle|ReceivingHostname|ReceivingApplicationEntityTitle|{attributeID})[!]={regEx}"
"dcmRetrieveAsReceived","प्राप्त हुए रूप में पुनःप्राप्त करें","पुनःप्राप्त हुए मिश्र ऑब्जेक्ट में डेटाबेस के जानकारी के विलीन को असमर्थ करता है, प्राप्त हुए रूप में ऑब्जेक्ट्स को वापस करता है. सिर्फ प्रभावशाली अगर डिमसे = C_STORE_RQ और डाइकोम स्थानांतरण भूमिका = SCP"
"dcmDeIdentification","पहचान हटाना","डाइकोम पी एस ३.१५ में निर्दिष्ट किए गए मूल अनुप्रयोग स्तर गोपनीयता रुपरेखा के अनुसार ऑब्जेक्ट्स की पहचान हटाए. किसी भी विकल्प को चुनने से मूल अनुप्रयोग स्तर गोपनीयता रुपरेखा हमेशा समावेश करेगा"
"dcmURI","एक्सएसएल स्टाइलशीट यूआरआई","गुण नियंत्रण का एक्सएसएल स्टाइलशीट यूआरआई निर्दिष्ट करता है"
"dcmNoKeywords","बिना गुण संकेतशब्द","गुण संकेतशब्दों को डाइकोम एक्सएम्एल (जिसे एक्सएसएलटी में भेजा जाता है) से हटाने का संकेत करता है"
"dcmMergeMWLMatchingKey","एम्डब्ल्यूएल मिलान कुंजी को विलीन करें","अनुरोधित गुणों का नियंत्रण करने के लिए इस्तमाल किए गए एम्डब्ल्यूएल आइटम जो प्राप्त हुए ऑब्जेक्ट के गुण से ढूंढा गया है उसे निर्दिष्ट करता है. अगर कॉन्फ़िगर ना किया हो तो, प्राप्त हुए ऑब्जेक्ट के अनुरोधित गुणों का नियंत्रण नहीं होगा"
"dcmMergeMWLTemplateURI","एम्डब्ल्यूएल फर्मा यूआरआइ को विलीन करें","मिलान एम्डब्ल्यूएल आइटम्स से प्राप्त हुए ऑब्जेक्ट के अनुरोधित गुणों का नियंत्रण करने के लिए इस्तमाल किए गए स्टाइलशीट यूआरआई को निर्दिष्ट करता है. सिर्फ प्रभावशाली अगर 'एम्डब्ल्यूएल मिलान कुंजी को विलीन करें' भी मौजूद है"
"dcmLeadingCFindSCP","प्रमुख सी-फाइंड एससीपी","बाहरी सी-फाइंड एससीपी के एइटी का नाम जिससे से प्राप्त किये गए मरीज़ों और स्टडीज के रेकॉर्ड्स के गुणों को इस्तमाल कर गुण नियंत्रण करें. सी-फाइंड एससीपी के लिए अगर कोई विशेष गुण सेट न निर्दिष्ट किया हो तो, मरीज़ और स्टडी गुण फ़िल्टर पे कॉन्फ़िगर किए गए सारे गुणों को प्राप्त किया जाएगा"
"dcmAttributeUpdatePolicy","गुण अपडेट नीति","प्रमुख सी-फाइंड एससीपी प्राप्त किए गए गुणों के साथ किस तरह गुणों को अपडेट किया जाएगा यह निर्दिष्ट करता है. PRESERVE (= मूल डेटासेट में अनुपलभ्य गुणों को नए डेटासेट में अमान्य करें), SUPPLEMENT (= मूल डेटासेट में अनुपलभ्य गुणों को पूरक किया जाएगा), REPLACE (= मूल डेटासेट पूरी तरह से बदला जाएगा), MERGE (= गुण के मूल्यों को नए डेटासेट से लिखा जाएगा), OVERWRITE (= अगर नए डेटासेट में गुण के मूल्य अनुपलभ्य हो तो मूल डेटासेट में अमान्य किया जाएगा)"
"dcmTrimISO2022CharacterSet","ट्रिम आईएसओ २०२२ कॅरक्टर सेट","कोड एक्सटेंशन के साथ सिंगल-बाइट कॅरक्टर सेट के कोड को बिना कोड एक्सटेंशन के सिंगल-बाइट कॅरक्टर सेट के कोड के साथ बदले. सिर्फ प्रभावशाली अगर डिमसे = C_STORE_RQ और डाइकोम स्थानांतरण भूमिका = SCU."
"dcmUseCallingAETitleAs","आह्वान एइ के नाम को इस रूप में इस्तमाल करें","अगर गुण अनुपलभ्य या खाली हो तो आह्वान एइटी के मूल्य को लागू करें. ScheduledStationAETitle (= अनुसूचित प्रक्रिया स्टेप क्रम (००४०,०१००) के आइटम में अनुसूचित स्टेशन एइ का नाम (००४०,०००१)), SendingApplicationEntityTitleOfSeries (= सीरीज भेजनेवाले अनुप्रयोग तत्त्व का नाम (७७७७,xx३७))."
"dcmNullifyTag","गुण टैग को अमान्य करें","हेक्स स्ट्रिंग के रूप में गुण का डाइकोम टैग जिसे अमान्य करना है"
"dcmMergeAttribute","गुणों को विलीन करें","डाइकोम गुणों को इस फॉर्मेट में {attributeID}={value} विलीन करें. {value} के अंदर {attributeID} को मूल डेटासेट में पाए गए गुण के मूल्य के साथ बदला जाएगा"
"dcmNullifyIssuerOfPatientID","मरीज़़ की आई.डी. का जारीकर्ता को अमान्य करें","प्राप्त हुए ऑब्जेक्ट्स में मरीज़़ की आई.डी. का जारीकर्ता (००१०,००२१) और मरीज़़ की आई.डी. का जारीकर्ता क्वालीफायर क्रम (००१०,००२४) को सशर्त रूप से अमान्य करें"
"dcmIssuerOfPatientID","मरीज़़ की आई.डी. का जारीकर्ता","मरीज़़ की आई.डी. का जारीकर्ता (००१०,००२१), और वैकल्पिक रूप से भी मरीज़़ की आई.डी. का जारीकर्ता क्वालीफ़ायर क्रम (००१०,००२४) के आइटम के यूनिवर्सल एंटिटी आई.डी. (००४०,००३२) और यूनिवर्सल एंटिटी आई.डी. प्रकार (००४०,००३३) के मूल्य को प्राप्त हुए ऑब्जेक्ट्स के गुणों के साथ मिलान किया जाएगा, सिर्फ लागू अगर 'मरीज़़ की आई.डी. का जारीकर्ता को अमान्य करें' को MATCHING या NOT_MATCHING कॉन्फ़िगर किया है. फॉर्मेट: <मरीज़़ की आई.डी. का जारीकर्ता> [& <यूनिवर्सल एंटिटी आई.डी.> & <यूनिवर्सल एंटिटी आई.डी. प्रकार>]."
"dcmIssuerOfPatientIDFormat","मरीज़़ की आई.डी. का जारीकर्ता का फॉर्मेट","अन्य गुणों से व्युत्पन्न किए गए मरीज़़ की आई.डी. का जारीकर्ता (००१०,००२१) का फॉर्मेट. उदाहरण के तौर पे ""{00100010,hash}-{00100030}"": ""-"" से अलग किए गए मरीज़ का नाम और मरीज़़ की जन्मतिथि का हैश मूल्य को इस्तमाल करें. प्राप्त हुए ऑब्जेक्ट्स में मौजूद मरीज़़ की आई.डी. के जारीकर्ता के मूल्यों का नियंत्रण करने के लिए 'मरीज़़ की आई.डी. का जारीकर्ता को अमान्य करें' के मूल्य को भी चुने"
"dcmSupplementFromDeviceName","Supplement from डिवाइस","डिवाइस का नाम जिसमे से समनुदेशन प्राधिकारीयां और अन्य जानकारी ली जाएगी to supplement प्राप्त हुए मिश्र ऑब्जेक्ट्स और एम्पीपीएस"
