"property","title","description"
"dcmFallbackCMoveSCPRetries","पलटाव सी-मूव एस.सी.पी. (C-Move SCP) पुनःपरीक्षण","कॉन्फ़िगर्ड 'पलटाव सी-मूव एस.सी.पी. (C-Move SCP)' से अनुपस्थित दृष्टांतों के पुनःप्राप्ति की अधिकतम संख्या ।-1 = हमेशा ।आर्काइव डिवाइस स्तर पे निर्दिष्ट मूल्य अधिलेखित होंगे ।"
"dcmFallbackWadoURIWebAppName","पलटाव वाडो-यू.आर.आइ. (WADO-URI) वेब अनुप्रयोग का नाम","यदि अनुरोधित दृष्टांत इस आर्काइव पे अनुपस्थित हो तो, बाहरी वेब अनुप्रयोग का नाम जहा पे वाडो-यू.आर.आइ. (WADO-URI) अनुरोधों को अनुप्रेषित किया जाएगा ।आर्काइव डिवाइस स्तर पे निर्दिष्ट मूल्य अधिलेखित होंगे ।"
"dcmFallbackWadoURIHttpStatusCode","पलटाव वाडो-यू.आर.आइ. (WADO-URI) एच.टी.टी.पी. (HTTP) स्थिति कोड","'पलटाव वाडो-यू.आर.आइ. (WADO-URI) वेब अनुप्रयोग के नाम' द्वारा कॉन्फ़िगर्ड एच.टी.टी.पी. (HTTP) स्थिति कोड ।आर्काइव डिवाइस स्तर पे निर्दिष्ट मूल्य अधिलेखित होंगे ।"
"dcmAltCMoveSCP","वैकल्पिक सी-मूव एस.सी.पी. (C-Move SCP)","वैकल्पिक सी-मूव एस.सी.पी. (C-Move SCP) के ए.इ. (AE) का नाम जहा पे सी-मूव आर.क्यू. (C-MOVE RQs) अनुरोधों को भेजा जाएगा, यदि अनुरोधित तत्वों स्थानीय स्टोरेज पे उपलब्ध नहीं है ।आर्काइव डिवाइस स्तर पे निर्दिष्ट मूल्य अधिलेखित होंगे ।"
"dcmStorePermissionServiceURL","संचय अनुमति सेवा का यू.आर.एल. (URL)","संचय अनुमति सेवा का यू.आर.एल. (URL) जिसे प्राप्त हुए स्टडी के पहले दृष्टांत के प्राप्ति पे बुलाया जाएगा ।{<dicomTag>} को दृष्टांत के गुण के मूल्य से बदला जाएगा ।उदाहरण के तौर पे : http(s)://<store-permission-service-provider-host>:<store-permission-service-provider-port>/storage-permission/study/{0020000D}?patientId={00100020}&patientIdIssuer={00100021}&studyDescription={00081030,urlencoded} ।आर्काइव डिवाइस स्तर पे निर्दिष्ट मूल्य अधिलेखित होंगे ।"
"dcmStorePermissionServiceResponse","संचय अनुमति सेवा प्रतिक्रिया","प्राप्त हुए स्टडी के पहले दृष्टांत के प्राप्ति पे संचय अनुमति सेवा प्रतिक्रिया के बराबर करें ।{<dicomTag>} को दृष्टांत के गुण के मूल्य से बदला जाएगा ।सिर्फ प्रभावशाली, यदि कोई ‘संचय अनुमति सेवा का यू.आर.एल.‘ कॉन्फ़िगर्ड नहीं है ।आर्काइव डिवाइस स्तर पे निर्दिष्ट मूल्य अधिलेखित होंगे ।"
"dcmStorePermissionServiceResponsePattern","संचय अनुमति सेवा प्रतिक्रिया पैटर्न","संचय अनुमति सेवा के प्रतिक्रियाओं पे लागू रेगुलर एक्सप्रेशन जो स्टोरज पे समझौते का तय करता है ।उदाहरण के तौर पे : ""validation""\s*:\s*""true"" ।आर्काइव डिवाइस स्तर पे निर्दिष्ट मूल्य अधिलेखित होंगे ।"
"dcmStorePermissionServiceErrorCommentPattern","संचय अनुमति सेवा त्रुटि टिप्पणि पैटर्न","संचय अनुमति सेवा के प्रतिक्रियाओं से त्रुटि टिप्पणि को निकालने के लिए लागू रेगुलर एक्सप्रेशन ।उदाहरण के तौर पे : ""errorcomment""\s*:\s*""(.*)"" ।आर्काइव डिवाइस स्तर पे निर्दिष्ट मूल्य अधिलेखित होंगे ।"
"dcmStorePermissionServiceErrorCodePattern","संचय अनुमति सेवा त्रुटि कोड पैटर्न","संचय अनुमति सेवा के प्रतिक्रियाओं से त्रुटि कोड को हेक्साडेसीमल में निकालने के लिए लागू रेगुलर एक्सप्रेशन ।उदाहरण के तौर पे ""errorcode""\s*:\s*""(\p{XDigit}{4})"" ।आर्काइव डिवाइस स्तर पे निर्दिष्ट मूल्य अधिलेखित होंगे ।"
"dcmStorePermissionServiceExpirationDatePattern","संचय अनुमति सेवा समाप्ति तारीख पैटर्न","संचय अनुमति सेवा के प्रतिक्रियाओं से प्राथमिक स्टडी समाप्ति तारीख को निकालने के लिए लागू रेगुलर एक्सप्रेशन ।उदाहरण के तौर पे ""expirationdate""\s*:\s*""([0-9]{8})"" ।आर्काइव डिवाइस स्तर पे निर्दिष्ट मूल्य अधिलेखित होंगे ।"
"dcmAllowRejectionForDataRetentionPolicyExpired","डेटा धारण नीति समाप्ति पे अस्वीकृति की अनुमति दे","डेटा धारण नीति समाप्ति पे अस्वीकृति की अनुमति दे ।आर्काइव डिवाइस स्तर पे निर्दिष्ट मूल्य अधिलेखित होंगे ।"
"dcmAllowDeleteStudyPermanently","स्टडी को पूरी तरह मिटाने की अनुमति दे","स्टडी को पूरी तरह मिटाने की अनुमति दे ।REJECTED = सिर्फ पहले से अस्वीकृत किए हुए स्टडीज ।आर्काइव डिवाइस स्तर पे निर्दिष्ट मूल्य अधिलेखित होंगे ।"
"dcmAllowDeletePatient","मरीज़ के रेकॉर्ड को मिटाने की अनुमति दे","मरीज़ के रेकॉर्ड को पूरी तरह मिटाने की अनुमति दे ।इन मूल्यों में से चुने : NEVER (= कभी नहीं), ALWAYS (= हमेशा), WITHOUT_STUDIES (= बिना स्टडीज के) ।आर्काइव डिवाइस स्तर पे निर्दिष्ट मूल्य अधिलेखित होंगे ।"
"dcmDefaultCharacterSet","डिफ़ॉल्ट कॅरक्टर सेट","इस नेटवर्क ए.इ. (AE) द्वारा पाए गए सी-स्टोर (C-Store) अनुरोधों के डेटा सेट्स और अनिर्णीत सी-फाइंड (C-FIND) प्रतिक्रियाएँ, जो विशिष्ट कॅरक्टर सेट (०००८,०००५) गुण के मूल्य के बिना हो, उनमें जोड़े गए विशिष्ट कॅरक्टर सेट (०००८,०००५) गुण का मूल्य ।आर्काइव डिवाइस स्तर पे निर्दिष्ट मूल्य अधिलेखित होंगे ।"
"dcmUPSWorklistLabel","यू.पी.एस. (UPS) कार्यसूची लेबल","इस नेटवर्क ए.इ. (AE) द्वारा निर्माण किए गए यू.पी.एस. (UPS) में कार्यसूची लेबल (००७४,१२०२) का मूल्य, यदि यू.पी.एस. पुश एस.सी.यू. (UPS Push SCU) या यू.पी.एस.-आर.एस. (UPS-RS) सेवा का उपभोक्ता इस गुण का मूल्य नहीं देता है ।यदि कॉन्फ़िगर न किया हो तो, बुलाए गए ए.इ. (AE) के नाम का इस्तमाल किया जाएगा ।आर्काइव डिवाइस स्तर पे निर्दिष्ट मूल्य अधिलेखित होंगे ।"
"dcmUPSEventSCU","यू.पी.एस. (UPS) घटना एस.सी.यू. (SCU)","यू.पी.एस. (UPS) घटना एस.ओ.पी. (SOP) वर्ग एस.सी.यू. (SCU) ए.इ. (AE) का नाम, जिसपे इस नेटवर्क ए.इ. (AE) पे निर्माण किए हुए सदस्य्ताओं के लिए यू.पी.एस. (UPS) घटना रिपोर्ट्स को स्वतंत्र रूप से भेजे जाएंगे - यदि सदस्य्ता एन.एक्शन डिमसे (N-ACTION DIMSE) सेवा या यू.पी.एस.-आर.एस. (UPS-RS) सेवा द्वारा निर्माण हुआ हो ।आर्काइव डिवाइस स्तर पे निर्दिष्ट मूल्य अधिलेखित होंगे ।"
"dcmUPSEventSCUKeepAlive","यू.पी.एस. (UPS) घटना एस.सी.यू. (SCU) ज़िंदा रखे","यू.पी.एस. (UPS) घटना एस.सी.यू. (SCU) को ज़िंदा रखने का मिलीसेकण्डों में समयपाल ।यदि कॉन्फ़िगर न किया हो तो, एक यू.पी.एस. (UPS) घटना एस.सी.यू. (SCU) पे विविध यू.पी.एस. (UPS) घटना रिपोर्ट्स को भेजने के लिए संपर्कों का फिरसे इस्तमाल नहीं किया जाएगा ।आर्काइव डिवाइस स्तर पे निर्दिष्ट मूल्य अधिलेखित होंगे ।"
"dcmRetrieveAET","पुनःप्राप्ति ए.इ. (AE) का नाम","इस नेटवर्क ए.इ. (AE) द्वारा प्राप्त हुए डाइकोम (DICOM) दृष्टांतों से सम्बंधित पुनःप्राप्ति ए.इ. (AE) के नामों को निर्दिष्ट करता है ।आर्काइव डिवाइस स्तर पे निर्दिष्ट मूल्य अधिलेखित होंगे ।"
"dcmReturnRetrieveAET","पुनःप्राप्ति ए.इ. (AE) का नाम लौटाए","सी-फाइंड (C-FIND) और क्वीडो (QIDO) प्रतिक्रियाओं में लौटाए हुए पुनःप्राप्ति ए.इ. (AE) का नाम ।यदि कॉन्फ़िगर न किया हो तो, संग्रहित तत्व से सम्बंधित पुनःप्राप्ति ए.इ. (AE) के नाम को लौटाया जाएगा ।आर्काइव डिवाइस स्तर पे निर्दिष्ट मूल्य अधिलेखित होंगे ।"
"dcmMultipleStoreAssociations","विविध संचय संपर्क","मिश्र दृष्टांतों के पुनःप्राप्ति में इस्तमाल हुए संचय संपर्कों की संख्या ।सी-स्टोर एस.सी.पी. (C-STORE SCP) से विशिष्ट संख्याएँ '<AETitle>:' उपसर्ग द्वारा निर्दिष्ट की जा सकती है ।आर्काइव डिवाइस स्तर पे निर्दिष्ट विविध संचय संपर्कों को पूरक करता है ।"
"dcmExternalRetrieveAEDestination","बाहरी पुनःप्राप्ति ए.इ. (AE) गंतव्य","बाहरी पुनःप्राप्ति ए.इ. (AE) पे भेजे गए सी-मूव आर.क्यू. (C-MOVE RQs) अनुरोधों में मूव गंतव्य के रूप में सेट किए हुए सी-स्टोर एस.सी.पी. (C-STORE SCP) ए.इ. (AE) का नाम ।आर्काइव डिवाइस स्तर पे निर्दिष्ट मूल्य अधिलेखित होंगे ।"
"dcmCopyMoveUpdatePolicy","कॉपी मूव अपडेट नीति","किसी स्टडी के दृष्टांतों को कॉपी या मूव करने पे गंतव्य स्टडी के गुणों पे लागू की गई नीति को निर्दिष्ट करता है ।यदि कॉन्फ़िगर न किया हो तो, गुणों को अपडेट नहीं किया जाएगा ।आर्काइव डिवाइस स्तर पे निर्दिष्ट मूल्य अधिलेखित होंगे ।"
"dcmLinkMWLEntryUpdatePolicy","एम्.डब्ल्यू.एल. (MWL) एंट्री संयुक्ति अपडेट नीति","पहले से मौजूद स्टडी को संदर्भित करनेवाले एम्.डब्ल्यू.एल. (MWL) एंट्री के साथ दूसरे स्टडी के दृष्टांतों को संयुक्त करने पे स्टडी के गुणों पे लागू हुई अपडेट नीति को निर्दिष्ट करता है ।आर्काइव डिवाइस स्तर पे निर्दिष्ट मूल्य अधिलेखित होंगे ।"
"dcmStorageVerificationPolicy","स्टोरेज सिद्धकरण नीति","DB_RECORD_EXISTS: सिर्फ डेटाबेस के रेकॉर्ड्स के  मौजूदगी की जाँच करें, OBJECT_EXISTS: जाँच करें यदि दृष्टांत स्टोरेज सिस्टम पे मौजूद है, OBJECT_SIZE: स्टोरेज सिस्टम पे दृष्टांत के माप की जाँच करें, OBJECT_FETCH: स्टोरेज सिस्टम से दृष्टांत को प्राप्त करें, OBJECT_CHECKSUM: स्टोरेज सिस्टम पे दृष्टांत के चेकसम की पुनर्गणना करें, S3_MD5SUM: एस.३. (S3) स्टोरेज सिस्टम पे डाइकोम (DICOM) फ़ाइल के एम्.डी.५. (MD5) की जांच योग करें ।आर्काइव डिवाइस स्तर पे निर्दिष्ट मूल्य अधिलेखित होंगे ।"
"dcmStorageVerificationUpdateLocationStatus","स्टोरेज सिद्धकरण स्थान की स्थिती का अपडेट","स्टोरेज सिद्धकरण पे डेटाबेस में स्थान के रेकॉर्ड की स्थिती को अपडेट करने का संकेत करता है ।प्रभावशाली नहीं होगा, यदि 'स्टोरेज सिद्धकरण नीति' का मूल्य DB_RECORD_EXISTS है ।आर्काइव डिवाइस स्तर पे निर्दिष्ट मूल्य अधिलेखित होंगे ।"
"dcmStorageVerificationStorageID","स्टोरेज सिद्धकरण स्टोरेज की कई आई.डी. (IDs)","स्टोरेज सिद्धकरण को सिर्फ तभी स्वीकार करें, यदि दृष्टांत के संचय का प्रमाणीकरण निर्दिष्ट किए हुए किसी एक स्टोरेज सिस्टम पे भी सफल हुआ हो ।प्रभावशाली नहीं होगा, यदि 'स्टोरेज सिद्धकरण नीति' का मूल्य DB_RECORD_EXISTS है ।आर्काइव डिवाइस स्तर पे निर्दिष्ट मूल्य अधिलेखित होंगे ।"
"dcmStorageVerificationInitialDelay","स्टोरेज सिद्धकरण प्राथमिक विलम्ब","आई.एस.ओ.-८६०१ (ISO-8601) कालावधि प्रारूप PnYnMnD or PnW में सीरीज के प्राप्ति पे उसके प्राथमिक स्टोरेज सिद्धकरण का विलम्ब ।आर्काइव डिवाइस स्तर पे निर्दिष्ट मूल्य अधिलेखित होंगे ।"
"dcmUpdateLocationStatusOnRetrieve","पुनःप्राप्ति पे स्थान की स्थिती का अपडेट","पुनःप्राप्ति पे स्टोरेज से दृष्टांतों की प्राप्ति असफल होने पे डेटाबेस में स्थान के रेकॉर्ड की स्थिती को 'MISSING_OBJECT' या 'FAILED_TO_FETCH_OBJECT' के मूल्य से अपडेट करने का संकेत करता है ।आर्काइव डिवाइस स्तर पे निर्दिष्ट मूल्य अधिलेखित होंगे ।"
"dcmStorageVerificationOnRetrieve","पुनःप्राप्ति पे स्टोरेज सिद्धकरण","पुनःप्राप्ति पे स्टोरेज से दृष्टांत के प्राप्ति में असफलताएँ हो तो सम्पूर्ण सीरीज के स्टोरेज सिद्धकरण को सक्रीय करने का संकेत करता है ।आर्काइव डिवाइस स्तर पे निर्दिष्ट मूल्य अधिलेखित होंगे ।"
"hl7PSUSendingApplication","एच.एल.७. (HL7) प्रक्रिया स्थिति अपडेट भेजनेवाला अनुप्रयोग","एच.एल.७. (HL7) प्रक्रिया स्थिति अपडेट संदेश भेजनेवाले अनुप्रयोग के अनुप्रयोग और सुविधा का नाम ।आर्काइव डिवाइस स्तर पे निर्दिष्ट मूल्य अधिलेखित होंगे ।"
"hl7PSUReceivingApplication","एच.एल.७. (HL7) प्रक्रिया स्थिति अपडेट प्राप्ति अनुप्रयोग","एच.एल.७. (HL7) प्रक्रिया स्थिति अपडेट प्राप्त करनेवाले अनुप्रयोग के अनुप्रयोग और सुविधा का नाम ।आर्काइव डिवाइस स्तर पे निर्दिष्ट मूल्य अधिलेखित होंगे ।"
"hl7PSUDelay","एच.एल.७. (HL7) प्रक्रिया स्थिति अपडेट विलम्ब","आई.एस.ओ.-८६०१ (ISO-8601) कालावधि प्रारूप PnDTnHnMnS में विलम्ब जिसके बाद प्राप्त हुए स्टडी के लिए एच.एल.७. (HL7) प्रक्रिया स्थिति अपडेट संदेश को कॉन्फ़िगर्ड एच.एल.७. (HL7) संदेश प्राप्त करनेवाले सिस्टम्स पे भेजा जाएगा ।यदि कॉन्फ़िगर न किया हो तो, एच.एल.७. (HL7) प्रक्रिया स्थिति अपडेट प्राप्त हुए एम्.पी.पी.एस. (MPPS) द्वारा सक्रीय होगी ।आर्काइव डिवाइस स्तर पे निर्दिष्ट मूल्य अधिलेखित होंगे ।"
"hl7PSUConditions","एच.एल.७. (HL7) प्रक्रिया स्थिति अपडेट गुण नियम","प्राप्त हुए मिश्र दृष्टांत के गुणों पे नियमों के द्वारा कॉन्फ़िगर्ड 'एच.एल.७. (HL7) प्रक्रिया स्थिति अपडेट प्राप्ति अनुप्रयोगों' पे भेजे गए प्रक्रिया स्थिति अपडेट संदेश के अधिसूचना को सीमित करें, इस प्रारूप में (SendingHostname|SendingApplicationEntityTitle|ReceivingHostname|ReceivingApplicationEntityTitle|{attributeID})[!]={regEx} ।आर्काइव डिवाइस स्तर पे निर्दिष्ट मूल्य अधिलेखित होंगे ।"
"hl7PSUForRequestedProcedure","अनुरोधित प्रक्रिया के लिए एच.एल.७. (HL7) प्रक्रिया स्थिति अपडेट","मिलान स्टडी दृष्टांत यू.आई.डी. (UID) के अनुरोधित प्रक्रिया के अनुसूचित प्रक्रिया स्टेप्स (डेटाबेस में एम्.डब्ल्यू.एल. (MWL) आइटम्स) की मौजूदगी पे कॉन्फ़िगर्ड 'एच.एल.७. (HL7) प्रक्रिया स्थिति अपडेट प्राप्ति अनुप्रयोगों' पे भेजे गए प्रक्रिया स्थिति अपडेट संदेश के अधिसूचना को सीमित करें ।आर्काइव डिवाइस स्तर पे निर्दिष्ट मूल्य अधिलेखित होंगे ।"
"hl7PSURequestedProcedureID","एच.एल.७. (HL7) प्रक्रिया स्थिति अपडेट अनुरोधित प्रक्रिया का आई.डी. (ID)","अधिसूचना संदेश में अनुरोधित प्रक्रिया के आई.डी. (ID) का मूल्य, यदि मिलान स्टडी दृष्टांत यू.आई.डी. (UID) के अनुरोधित प्रक्रिया के अनुसूचित प्रक्रिया स्टेप्स (डेटाबेस में एम्.डब्ल्यू.एल. (MWL) आइटम्स) नहीं है ।प्राप्त हुए स्टडी में {<attributeID>} गुण के मूल्य से बदला जाएगा ।आर्काइव डिवाइस स्तर पे निर्दिष्ट मूल्य अधिलेखित होंगे ।"
