"property","title","description"
"","नेटवर्क संपर्क एक्सटेंशन","डीसीएम्४ची (DCM4CHE) मालिकाना नेटवर्क संपर्क के गुण ।"
"dcmProtocol","प्रोटोकॉल","नेटवर्क संपर्क का प्रोटोकॉल ।"
"dcmHTTPProxy","एच.टी.टी.पी. (HTTP) प्रॉक्सी","एच.टी.टी.पी. (HTTP) प्रॉक्सी : [user:password@]host:port ।"
"dcmTLSNeedClientAuth","टी.एल.एस. क्लाइंट प्रमाणीकरण ज़रूरी","संकेत करता है की, टी.एल.एस. क्लाइंट प्रमाणीकरण ज़रूरी है ।"
"dcmTLSProtocol","टी.एल.एस. प्रोटोकॉल","समर्थित टी.एल.एस. प्रोटोकॉल ।"
"dcmTCPBacklog"," टी.सी.पी. (TCP) बैकलॉग","आनेवाले  टी.सी.पी. (TCP) संपर्कों के लिए अधिकतम कतार की लम्बाई ।"
"dcmTCPConnectTimeout"," टी.सी.पी. (TCP) संपर्क समय","मिलीसेकण्डों में  टी.सी.पी. (TCP) संपर्क समय; निर्दिष्ट नहीं किया है, तो कोई समय लागू नहीं होगा ।"
"dcmTCPCloseDelay"," टी.सी.पी. (TCP) बंद करने का विलम्ब","ए-एसोसिएट-आर.जे. (A-ASSOCIATE-RJ), ए-रिलीज़-आर.पी. (A-RELEASE-RP) या ए-अबो्र्ट (A-ABORT) पी.डी.यू. (PDU) को भेजने के बाद  टी.सी.पी. (TCP) सॉकेट को बंद करने के लिए मिलीसेकण्डों में विलम्ब ।"
"dcmTCPSendBufferSize"," टी.सी.पी. (TCP) भेजे गए बफर का माप"," टी.सी.पी. (TCP) भेजे गए बफर का माप; यदि निर्दिष्ट नहीं किया है, तो सिस्टम डिफॉल्ट्स का उपयोग करें ।"
"dcmTCPReceiveBufferSize"," टी.सी.पी. (TCP) बफर प्राप्ति का माप"," टी.सी.पी. (TCP) बफर प्राप्ति का माप; यदि निर्दिष्ट नहीं किया है, तो सिस्टम डिफॉल्ट्स का उपयोग करें ।"
"dcmTCPNoDelay"," टी.सी.पी. (TCP) विलम्ब नहीं"," टी.सी.पी. (TCP) विलम्ब नहीं को सक्षम या असक्षम करें (Nagle अल्गोरिथम को सक्षम या असक्षम करें ) ।"
"dcmBindAddress","बांधने का पता","सुननेवाले सॉकेट को बांधने का पता; यदि निर्दिष्ट नहीं किया है, तो संपर्क के मेज़बान का नाम का उपयोग करें ।"
"dcmClientBindAddress","क्लाइंट को बांधने का पता","बहार जानेवाले संपर्कों को बांधने का पता; यदि निर्दिष्ट नहीं किया है, तो संपर्क के मेज़बान का नाम का उपयोग करें ।"
"dcmBlacklistedHostname","कालीसूची में डाले हुए मेज़बान के नाम","कालीसूची में डाले हुए डी.एन.एस. (DNS) मेज़बान के नाम ।"
"dcmSendPDULength","भेजे हुए पी.डी.यू. (PDUs) की लम्बाई","भेजे हुए पी.डी.यू. (PDUs) की अधिकतम लम्बाई ।"
"dcmReceivePDULength","पी.डी.यू. (PDU) प्राप्ति की लम्बाई","पी.डी.यू. (PDUs) प्राप्ति की अधिकतम लम्बाई ।"
"dcmMaxOpsPerformed","अधिकतम कार्य संपादित","कार्यों को अतुल्यकालिक रूप से संपादित करने की अधिकतम संख्या; ० = अनन्त ।"
"dcmMaxOpsInvoked","अधिकतम कार्य लागू","कार्यों को अतुल्यकालिक रूप से लागू करने की अधिकतम संख्या; ० = अनन्त ।"
"dcmPackPDV","पी.डी.वी. (PDV) पैक करें","एक पी-डेटा-टी.एफ. (P-DATA-TF) पी.डी.यू. (PDU) में कमांड और डेटा पी.डी.वी. (PDVs) को पैक करने में सक्षम या असक्षम करें ।"
"dcmAARQTimeout","ए.ए.-आर.क्यू. (AA-RQ) समय"," टी.सी.पी. (TCP) संपर्क के बाद ए-एसोसिएट-आर.क्यू. पी.डी.यू. (A-ASSOCIATE-RQ PDU) को प्राप्त करने के लिए मिलीसेकण्डों में समय; निर्दिष्ट नहीं किया है, तो कोई समय लागू नहीं होगा ।"
"dcmAAACTimeout","ए.ए.-ए.सी. (AA-AC) समय","ए-एसोसिएट-आर.क्यू. पी.डी.यू. (A-ASSOCIATE-RQ PDU) के भेजने के बाद ए-एसोसिएट-ए.सी. पी.डी.यू. (A-ASSOCIATE-AC PDU) को प्राप्त करने के लिए मिलीसेकण्डों में समय; निर्दिष्ट नहीं किया है, तो कोई समय लागू नहीं होगा ।"
"dcmARRPTimeout","ए.आर.-आर.पी. (AR-RP) समय","ए-रिलीज़-आर.क्यू. पी.डी.यू. (A-RELEASE-RQ PDU) के भेजने के बाद ए-रिलीज़-आर.पी. पी.डी.यू. (A-RELEASE-RP PDU) को प्राप्त करने के लिए मिलीसेकण्डों में समय; निर्दिष्ट नहीं किया है, तो कोई समय लागू नहीं होगा ।"
"dcmSendTimeout","भेजने का समय","सी-स्टोर (C-STORE) अनुरोधों के अलावा अन्य डिमसे अनुरोधों को भेजने के लिए मिलीसेकण्डों में समय; निर्दिष्ट नहीं किया है, तो कोई समय लागू नहीं होगा ।"
"dcmStoreTimeout","संचय समय","सी-स्टोर (C-STORE) अनुरोधों को भेजने के लिए मिलीसेकण्डों में समय; निर्दिष्ट नहीं किया है, तो कोई समय लागू नहीं होगा ।"
"dcmResponseTimeout","प्रतिक्रिया समय","सी-गेट (C-GET) या सी-मूव (C-MOVE) प्रतिक्रियाओं के अलावा अन्य डिमसे प्रतिक्रियाओं को प्राप्त करने के लिए मिलीसेकण्डों में समय; निर्दिष्ट नहीं किया है, तो कोई समय लागू नहीं होगा ।"
"dcmRetrieveTimeout","पुनःप्राप्ति समय","शेष सी-गेट (C-GET) या सी-मूव (C-MOVE) प्रतिक्रियाओं को प्राप्त करने के लिए मिलीसेकण्डों में समय; निर्दिष्ट नहीं किया है, तो कोई समय लागू नहीं होगा ।"
"dcmRetrieveTimeoutTotal","संपूर्ण पुनःप्राप्ति समय","शेष सी-गेट (C-GET) और सी-मूव (C-MOVE) प्रतिक्रियाओं को अनिर्णीत प्रतिक्रियाओं के प्राप्ति पे निर्दिष्ट समय के समयपाल को पुनःप्रारंभ किया जाएगा (= नहीं false) या नहीं (= हाँ true) ।"
"dcmIdleTimeout","निष्क्रिय समय","निर्दिष्ट समय (मिलीसेकण्डों में) के बाद निष्क्रिय संपर्कों को बंद करने संकेत करता है; निर्दिष्ट नहीं किया है, तो कोई समय लागू नहीं होगा ।"