"property","title","description"
"","HL7 निर्यात नियम","HL7 निर्यात नियम ।"
"cn","नाम","HL7 निर्यात नियम का मनमाना/सार्थक नाम ।"
"dcmExporterID","निर्यातक ID","निर्यातक ID ।"
"dcmProperty","नियम","नियम इस प्रारूप में {SEG}-{Seq#}[.{Comp#}[.{SubComp#}]][!]={regEx}. उदाहरण के तौर पे: MSH-4=FORWARD या MSH-9=ORM\^O01 या PID-3[.3]=PIDIssuer या PID-3[.3[.2]]=PIDIssuerUniversalEntityIDType ।"
"dcmEntitySelector","तत्व चयनकर्ता","निर्यात करने के लिए स्टडीज को चुनने में इस्तमाल किए गए मिलान कुंजियों को निर्दिष्ट करता है । प्रारूप : {कुंजी}={मूल्य}[&{कुंजी}={मूल्य)]..., जहा {कुंजी} = 'StudyAge' | {attributeID} । इस प्रारूप में '$'{SEG}-{Seq#}[.{Comp#}[.{SubComp#}]] में जो {मूल्य} है, वे HL7 संदेश, जिससे निर्यात सक्रीय हुआ, उसके HL7 फील्ड के मूल्य से बदले जाएंगे । यदि कोई तत्व चयनकर्ता निर्दिष्ट नहीं किया है, तो मरीज़ के सारे स्टडीज निर्यात होंगे । उदाहरण के तौर पे: 'priors=2&StudyAge=-5Y&ModalitiesInStudy=CT' => अधिक से अधिक पिछले २ स्टडीज जो ५ साल से पुराने न होकर और जिनमे कम से कम एक CT सीरीज हो ।"
"dcmNullifyIssuerOfPatientID","मरीज़़ की ID के जारीकर्ता को नज़रअंदाज़ करें","प्राप्त हुए HL7 संदेश, जिससे मरीज़़ के चुने हुए स्टडीज का निर्यात सक्रीय हुआ, में मरीज़़ की ID के जारीकर्ता पी.आई.डी.-३.४ (याने की पी.आई.डी. सेगमेंट के तीसरे फील्ड के चौथे कॉम्पोनेन्ट में पाया जाता है; PID-3.4) को सशर्त रूप से नज़रअंदाज़ करें ।"
"dcmIssuerOfPatientID","मरीज़़ की ID का जारीकर्ता","प्राप्त हुए HL7 संदेश में मरीज़़ की ID का जारीकर्ता के मूल्य के साथ मेल मिलनेवाले मरीज़़ की ID का जारीकर्ता के मूल्य, यदि मरीज़़ की ID का जारीकर्ता को MATCHING या NOT_MATCHING सेट किया है । प्रारूप: <मरीज़़ की ID का जारीकर्ता> [& <यूनिवर्सल एंटिटी ID> & <यूनिवर्सल एंटिटी ID प्रकार>] ।"
"dcmPrefetchForIssuerOfPatientID","Export for Assigning Authority of Patient ID","Assigning Authority of Patient ID in received HL7 message used to search qualified patient identifier in list of identifiers in PID-3. Studies matching the specified Entity Selector of this qualified patient identifier shall be queried. If absent, by default the first qualified patient identifier in PID-3 shall be used. Format: <Issuer of Patient ID> [& <Universal Entity ID> & <Universal Entity ID Type>]."
"dcmDuration","द्वीगुण निर्यात का अधीन अंतराल","द्वीगुण निर्यात टालने के लिए, जो स्टडीज निर्दिष्ट अंतराल के बाद निर्यात किए गए हो, उन स्टडीज को फिरसे निर्यात करना अधीन करें ।"
