"property","title","description"
"","अस्वीकृति नोट","अस्वीकृति नोट के सहेजने पे बर्ताव निर्दिष्ट करता है ।"
"dcmRejectionNoteLabel","अस्वीकृति नोट लेबल","अस्वीकृति नोट लेबल ।"
"dcmRejectionNoteType","अस्वीकृति नोट का प्रकार","अस्वीकृति नोट का प्रकार ।"
"dcmRejectionNoteCode","अस्वीकृति नोट कोड","अस्वीकृति नोट का दस्तावेज़ नाम इस प्रारूप में (CV, CSD, 'CM') निर्दिष्ट करता है ।"
"dcmAcceptPreviousRejectedInstance","पिछले अस्वीकृत किए हुए दृष्टांत को स्वीकार करें","विशिष्ट अस्वीकृति नोट द्वारा अस्वीकृत किए गए दृष्टांतों फिरसे प्राप्त होने पे बर्ताव निर्दिष्ट करता है ।"
"dcmOverwritePreviousRejection","पिछले अस्वीकृति नोट को अधिलेखित करें","पिछले अस्वीकृति नोट का दस्तावेज़ नाम इस प्रारूप में (CV, CSD, 'CM'), जो इस अस्वीकृति नोट द्वारा अधिलेखित होगा, यह निर्दिष्ट करता है ।"
"dcmAcceptRejectionBeforeStorage","अस्वीकृति नोट को दृष्टांतों के सहेजने से पहले स्वीकार करें","अस्वीकृति नोट के प्राप्ति के बाद का आई.एस.ओ.-८६०१ (ISO-8601) कालावधि प्रारूप PnDTnHnMn.nS में समय अंतराल, जिसमे इस अस्वीकृति नोट द्वारा संदर्भित प्राप्त हुए दृष्टांतों को अस्वीकृत के रूप में माना जाएगा ।बाद में प्राप्त संदर्भित दृष्टांतों को पहले से अस्वीकृत किए गए दृष्टांत के रूप में माना जाएगा ।यदि निर्दिष्ट नहीं किया गया है, तो अस्वीकृति नोट्स जो अभी तक प्राप्त दृष्टांतों को संदर्भित नहीं करते हैं उन्हें स्वीकार नहीं किया जाएगा ।"
"dcmDeleteRejectedInstanceDelay","अस्वीकृत किए हुए दृष्टांत को मिटाने का विलम्ब","आई.एस.ओ.-८६०१ (ISO-8601) कालावधि प्रारूप PnDTnHnMn.nS में विलम्ब जिसके बाद विशिष्ट अस्वीकृति नोट द्वारा अस्वीकृत किए गए दृष्टांतों को मिटाया जाएगा ।यदि निर्दिष्ट नहीं किया गया है, तो अनन्त ।"
"dcmDeleteRejectionNoteDelay","अस्वीकृति नोट को मिटाने का विलम्ब","आई.एस.ओ.-८६०१ (ISO-8601) कालावधि प्रारूप PnDTnHnMn.nS में विलम्ब जिसके बाद विशिष्ट अस्वीकृति नोट्स मिटाए जाएंगे ।यदि निर्दिष्ट नहीं किया गया है, तो अनन्त ।"