"property","title","description"
"","संचय प्रवेश निरीक्षण आई.डी. नियम","संचय प्रवेश निरीक्षण आई.डी. नियम ।"
"cn","नाम","संचय प्रवेश निरीक्षण आई.डी. नियम का मनमाना/सार्थक नाम ।"
"dcmStoreAccessControlID","संचय प्रवेश निरीक्षण आई.डी.","सारे गुणों के नियम मिलने पे स्टडीज पे निरूपण किया गया प्रवेश निरीक्षण आई.डी. ।"
"dcmRulePriority","नियम प्राथमिकता","नियम प्राथमिकता ।"
"dcmProperty","नियम","नियम इस प्रारूप में (SendingHostname|SendingApplicationEntityTitle|ReceivingHostname|ReceivingApplicationEntityTitle|{attributeID})[!]={regEx} ।"