"property","title","description"
"","ए.इ.टी. (AET) की सूची","ए.इ.टी. (AET) की सूची ।"
"dcmuiAetListName","सूची का नाम","इस कॉन्फिग के लिए एक नाम परिभाषित करें ।"
"dcmuiAetListDescription","वर्णन","ए.इ.टी. (AET) की सूची का वर्णन ।"
"dcmuiMode","ए.इ.टी. (AET) की सूची का प्रकार","परिभाषित करें कि यह विन्यास किस प्रकार में उपलब्ध होना चाहिए : 'internal' (आर्काइव के अपने ए.इ.टी. (AET), कुछ जगहों में इसे 'Home AET' या 'Local AET' भी कहा गया है), या 'external' ( या कुछ जगहों में इसे 'Remote AET' भी कहा गया है) ए.इ.टी. (AET) की सूची, दोनों प्रकारों में उपलब्ध होने के लिए, किसी भी विकल्प को न चुने ।"
"dcmuiAets","ए.इ.टी. (AET)","ए.इ.टी. (AET) ।"
"dcmAcceptedUserRole","स्वीकृत उपभोक्ता की भूमिकाएँ","उन भूमिकाओं को परिभाषित करें जिनके लिए यह कॉन्फिग उपलब्ध होना चाहिए, सारे भूमिकाओं पे उपलब्ध होने के लिए 'user' का इस्तमाल करें ।"