"property","title","description"
"","यू.आई. स्टडी सारिणी विन्यास","प्रो संस्करण के लिए स्टडी सारिणी विन्यास ।"
"dcmuiStudyTableConfigName","विन्यास का नाम","यू.आई. स्टडी सारिणी विन्यास का नाम ।"
"dcmuiStudyTableConfigUsername","उपभोक्ता का नाम","उपभोक्ता का नाम जिसके लिए यह सेट उपलब्ध होना चाहिए ।"
"dcmuiStudyTableConfigRoles","भूमिका","उपभोक्ता की भूमिका जो यह सेट इस्तमाल कर सके ( उपभोक्ता का नाम निर्दिष्ट किया हो तो, भूमिका नज़रअंदाज़ होगी) ।"
"dcmuiStudyTableConfigIsDefault","डिफ़ॉल्ट है","इस कॉलम-सेट को डिफ़ॉल्ट के रूप में सेट करें ।(सुनिश्चित करें की सिर्फ किसी एक सेट को डिफ़ॉल्ट के रूप में सेट करें) ।"
"dcmuiStudyTableColumnConfigObjects","स्टडी सारिणी कॉलम","स्टडी सारिणी कॉलम को परिभाषित करें ।"