"property","title","description"
"","MWL アイドル タイムアウト","MWL アイドル タイムアウト"
"cn","名前","MWL アイドル タイムアウトの 任意 / 意味の ある 名前。"
"dicomAETitle","MWL SCP AE タイトル","MWL アイドル タイムアウトが 適用される MWL SCPの アーカイブ AE タイトル。"
"dcmAETitle","予定された ステーション AE タイトル","MWL アイドル タイムアウトが 適用される 予定された 手順 ステップの 予定された ステーション AE タイトル。 何も 指定されて いない 場合、 MWL アイドル タイムアウトは、 MWL SCPに よって 提供される すべての 予定された 手順 ステップに 適用されます。"
"dcmMWLStatusOnIdle","アイドル時の MWL ステータス","アイドル 予定 手順 ステップの ステータスを 指定した 値に 変更します。"
"dcmDuration","アイドル タイムアウト","タイムアウト後、 一致 する 予定 手順 ステップの ステータスが 指定された 最終 ステータスに 変更されます。"
