"property","title","description"
"","拒否 ノート","保存された 拒否 ノートの 動作を 指定します"
"dcmRejectionNoteLabel","拒否 ノート ラベル","拒否 ノート ラベル"
"dcmRejectionNoteType","拒否 ノートの タイプ","拒否 ノートの タイプ。"
"dcmRejectionNoteCode","拒否 ノート コード","拒否 ノートの ドキュメント タイトルを 形式 (CV, CSD, 'CM') で 指定します"
"dcmAcceptPreviousRejectedInstance","以前の 拒否された インスタンスを 受け入れる","特定の 拒否 ノートに よって 拒否された インスタンスの 後続の 発生時に 動作を 指定します。"
"dcmOverwritePreviousRejection","以前の 拒否を 上書き","その 拒否 ノートに よって 上書きされる 可能性が ある 形式 (CV, CSD, 'CM') で 以前の 拒否 ノートの ドキュメント タイトルを 指定します"
"dcmAcceptRejectionBeforeStorage","保存の 前に 拒否を 受け入れ","拒否 ノートの 受信後の ISO-8601 期間 形式 PnDTnHnMn.nSの 時間 間隔、 この 拒否 ノートに よって 参照される 受信 オブジェクトは 拒否された ものとして 扱われます。 後で 受信された 参照 オブジェクトは、 すでに 拒否された インスタンスの 後続の 発生として 扱われます。 存在しない 場合、 まだ 受信されて いない オブジェクトを 参照する 拒否 ノートは 受け入れられません。"
"dcmDeleteRejectedInstanceDelay","削除 拒否された インスタンス 遅延","ISO-8601 期間 形式PnDTnHnMn.nS で  遅延、 その 後、 特定の 拒否 ノートに よって 拒否された インスタンスを 削除する。 存在しない 場合は 無限。"
"dcmDeleteRejectionNoteDelay","削除 拒否 ノート 遅延","特定の 拒否 ノートを 削除する ISO-8601 期間 形式で PnDTnHnMn.nS 遅延。 存在しない 場合は 無限。"
