"property","title","description"
"","UI Study Table Columns Configuration","Study Table Columns"
"dcmuiColumnName","Column Name","The Name of the Column in the Study Table"
"dcmuiColumnTitle","Column Description","Description of the Column, shown on hover"
"dcmuiValuePath","Value path","Value (json-Object) Path of the column (for Example: '00100010.Value[0].Alphabetic' for Patient's Name or '00100020.Value[0]' for Patient ID"
"dcmuiValueType","Type of the value","Type of the column how to get the value, default should be 'value'"
"dcmuiColumnWidth","Column width in weight","Width of the column in weight ( x > 0.1 - x < infinite ) default 1"
"dcmuiColumnOrder","Column width in weight","Width of the column in weight ( x > 0.1 - x < infinite ) default 1"
